{
  "schemaVersion": 1,
  "projectId": "import:test",
  "name": "Imported synthetic grid",
  "revision": 0,
  "createdAt": "2026-09-01T00:00:00Z",
  "updatedAt": "2026-09-29T00:00:00Z",
  "width": 3,
  "height": 2,
  "palette": {
    "schemaVersion": 1,
    "id": "demo:palette",
    "version": "1",
    "name": "Synthetic fixture only",
    "provenance": {
      "kind": "demo",
      "description": "Synthetic materials, not purchasing data",
      "capturedOn": "2026-09-29",
      "licenseNote": "Test data"
    },
    "colors": [
      {
        "index": 1,
        "id": "demo:white",
        "code": "W",
        "name": "Demo white",
        "displayHex": "#FFFFFF",
        "brand": "DEMO",
        "series": "fixture",
        "finish": "opaque",
        "enabled": true,
        "conceptOnly": true,
        "material": {
          "fuseFamily": "unknown",
          "compatibility": "unknown"
        }
      },
      {
        "index": 2,
        "id": "demo:red",
        "code": "R",
        "name": "Demo red",
        "displayHex": "#FF0000",
        "brand": "DEMO",
        "series": "fixture",
        "finish": "opaque",
        "enabled": true,
        "conceptOnly": true,
        "material": {
          "fuseFamily": "unknown",
          "compatibility": "unknown"
        }
      },
      {
        "index": 3,
        "id": "demo:clear",
        "code": "C",
        "name": "Demo clear",
        "displayHex": "#FFFFFF",
        "brand": "DEMO",
        "series": "fixture",
        "finish": "clear",
        "enabled": true,
        "conceptOnly": true,
        "material": {
          "fuseFamily": "unknown",
          "compatibility": "unknown"
        }
      }
    ]
  },
  "cells": [
    1,
    0,
    3,
    2,
    1,
    3
  ],
  "progress": [
    0,
    0,
    0,
    0,
    0,
    0
  ],
  "locks": [
    0,
    0,
    0,
    0,
    0,
    0
  ],
  "mode": "single",
  "recipe": {
    "algorithmVersion": "explicit-import-settings-v1",
    "fit": "contain",
    "backgroundMode": "none",
    "coverageThreshold": 0.5,
    "maxColors": 3,
    "seed": 0,
    "style": "faithful",
    "dither": "none",
    "sampling": "area"
  },
  "board": {
    "columns": 29,
    "rows": 29,
    "source": "User-supplied logical layout; physical dimensions unknown"
  },
  "notes": "Imported Pindo v1 metadata: {\"brand\":\"perler\",\"width\":3,\"height\":2,\"dithering\":\"none\",\"background\":\"transparent\",\"createdAt\":\"2026-09-01T00:00:00Z\",\"sourceHash\":\"legacy-source-reference\"}"
}
